<?xml version="1.0" encoding="UTF-8"?>
<dataroot xmlns:od="urn:schemas-microsoft-com:officedata" xmlns:xsi="http://www.w3.org/2001/XMLSchema-instance"  xsi:noNamespaceSchemaLocation="AmuletImplicitMod.xsd" generated="2017-09-01T21:58:04">
<AmuletImplicitMod>
<ID>1</ID>
<GivenID>-1</GivenID>
<MinValue>0</MinValue>
<MaxValue>0</MaxValue>
<Level>1</Level>
<ModType>8</ModType>
<ModName>없음</ModName>
</AmuletImplicitMod>
<AmuletImplicitMod>
<ID>2</ID>
<GivenID>0</GivenID>
<MinValue>5</MinValue>
<MaxValue>10</MaxValue>
<Level>1</Level>
<ModType>8</ModType>
<ModName>아뮬렛옵1</ModName>
</AmuletImplicitMod>
<AmuletImplicitMod>
<ID>3</ID>
<GivenID>1</GivenID>
<MinValue>5</MinValue>
<MaxValue>10</MaxValue>
<Level>1</Level>
<ModType>11</ModType>
<ModName>아뮬렛옵2</ModName>
</AmuletImplicitMod>
<AmuletImplicitMod>
<ID>4</ID>
<GivenID>2</GivenID>
<MinValue>5</MinValue>
<MaxValue>10</MaxValue>
<Level>1</Level>
<ModType>14</ModType>
<ModName>아뮬렛옵3</ModName>
</AmuletImplicitMod>
<AmuletImplicitMod>
<ID>5</ID>
<GivenID>3</GivenID>
<MinValue>5</MinValue>
<MaxValue>10</MaxValue>
<Level>1</Level>
<ModType>16</ModType>
<ModName>아뮬렛옵4</ModName>
</AmuletImplicitMod>
<AmuletImplicitMod>
<ID>6</ID>
<GivenID>4</GivenID>
<MinValue>50</MinValue>
<MaxValue>100</MaxValue>
<Level>1</Level>
<ModType>6</ModType>
<ModName>아뮬렛옵5</ModName>
</AmuletImplicitMod>
<AmuletImplicitMod>
<ID>7</ID>
<GivenID>5</GivenID>
<MinValue>50</MinValue>
<MaxValue>100</MaxValue>
<Level>1</Level>
<ModType>3</ModType>
<ModName>아뮬렛옵6</ModName>
</AmuletImplicitMod>
<AmuletImplicitMod>
<ID>8</ID>
<GivenID>6</GivenID>
<MinValue>50</MinValue>
<MaxValue>100</MaxValue>
<Level>1</Level>
<ModType>3</ModType>
<ModName>아뮬렛옵7</ModName>
</AmuletImplicitMod>
<AmuletImplicitMod>
<ID>9</ID>
<GivenID>7</GivenID>
<MinValue>50</MinValue>
<MaxValue>100</MaxValue>
<Level>1</Level>
<ModType>12</ModType>
<ModName>아뮬렛옵8</ModName>
</AmuletImplicitMod>
</dataroot>
